qid;docid;title;abstract
cf0a23a14082d55d74fad12e78a868e6;303491674;PENGARUH KONSENTRASI PELARUT KOH K2CO3 PADA PEMBUATAN ELEKTROLIT BIO-BATERAI DARI LIMBAH KULIT PISANG AMBON (MUSA PARADISIACA);Penelitian ini mengkaji pengaruh jenis dan konsentrasi pelarut KOH dan K2CO3 terhadap karakteristik elektrolit bio-baterai yang dibuat dari limbah kulit pisang ambon (Musa paradisiaca). Penelitian dilakukan dengan pendekatan eksperimental menggunakan variasi konsentrasi pelarut (0,5 M – 2 M) dan massa kulit pisang (15 g dan 30 g). Parameter yang diamati meliputi tegangan, arus, daya listrik, pH, konduktivitas, kapasitas baterai, korosi elektroda, serta pengujian aplikasi terhadap beban nyata seperti lampu LED dan mini fan. Hasil penelitian menunjukkan bahwa pelarut KOH memberikan performa kelistrikan terbaik pada konsentrasi 1 M dan massa kulit pisang 30 g, dengan daya maksimum sebesar 14,52 mW dan kapasitas 172,53 mAh. Namun, pelarut ini juga menunjukkan tingkat korosi yang lebih tinggi terhadap elektroda dibandingkan K2CO3. Sebaliknya, pelarut K2CO3 lebih stabil dan ramah terhadap elektroda, meskipun daya listrik yang dihasilkan relatif lebih rendah. Konsentrasi optimal kedua pelarut berada pada 1 M, di mana efisiensi reaksi elektrokimia dan daya tahan bio-baterai mencapai titik terbaik. Pengujian aplikasi menunjukkan bahwa kombinasi 30 g kulit pisang dengan KOH 1 M mampu menyalakan LED terang selama 3 jam 28 menit dan mini fan dengan kecepatan penuh. Penelitian ini membuktikan bahwa limbah kulit pisang berpotensi besar sebagai bahan baku elektrolit dalam bio-baterai, dan pemilihan pelarut serta konsentrasinya sangat menentukan kinerja serta ketahanan sistem
cf0a23a14082d55d74fad12e78a868e6;308917452;Material Flow Analysis Pengelolaan Limbah Elektronik dari Perangkat Non-Baterai;"Pertumbuhan produksi dan konsumsi perangkat elektronik yang pesat dalam dua dekade terakhir memicu peningkatan limbah elektronik atau e-waste. Meskipun telah dibatasi, perdagangan global limbah elektronik tetap berjalan. Di Indonesia, aktivitas ekspor dan impor limbah elektronik masih terjadi, termasuk di Kota Surabaya yang merupakan salah satu konsumen elektronik terbesar. Namun, pengelolaan limbah elektronik masih menghadapi kendala seperti kurangnya regulasi khusus dan data aliran material yang memadai. Penelitian ini bertujuan untuk menentukan gambaran dan menganalisis aliran ekspor dan impor limbah elektronik HS 85493900 dari dan ke Indonesia, mengkaji aliran material limbah elektronik dari perangkat non baterai, dan mengevaluasi pengelolaannya di area perumahan Kecamatan Genteng, Kota Surabaya.

Penelitian ini dilakukan dengan pengumpulan data sekunder mengenai kegiatan ekspor dan impor limbah elektronik HS 85493900. Selanjutnya, dilakukan analisis pola aliran ekspor dan impor limbah elektronik HS 85493900 dari dan ke Indonesia. Penelitian ini kemudian dilanjutkan dengan pengumpulan data untuk pengukuran timbulan limbah elektronik, pengetahuan, sikap, dan perilaku masyarakat dalam pengelolaan limbah elektronik. Pengumpulan data dilakukan melalui wawancara pada 200 kepala keluarga (KK) dan pencarian data sekunder. Data yang telah dikumpulkan kemudian dihitung potensi laju timbulannya (kg/tahun). Selanjutnya, untuk memastikan keakuratan data serta memperdalam informasi yang diperoleh, dilakukan verifikasi dengan metode Snowball Sampling pada sektor informal. Berdasarkan analisis data ekspor-impor limbah elektronik non-baterai, pada periode 2022–2024, ekspor Indonesia (HS 85493900) tercatat mencapai 3.349.451,93 kg, jauh lebih tinggi dibandingkan impor sebesar 5.435 kg. Di Kecamatan Genteng, potensi timbulan limbah elektronik rumah tangga dari perangkat non-baterai diperkirakan sebesar 502.072 kg per tahun, dengan kontribusi terbesar berasal dari kelompok keluarga sejahtera. Sebagian besar masyarakat (44%) cenderung mengelola limbah elektronik dengan menjualnya kepada pengepul. Partisipasi masyarakat menunjukkan perbedaan pada aspek pengetahuan (32%), sikap (80%), dan perilaku (66%), di mana hanya pengetahuan dan sikap yang terbukti

berpengaruh signifikan terhadap perilaku berdasarkan analisis SEM-PLS, sedangkan usia, jenis kelamin, dan tingkat kesejahteraan tidak memberikan pengaruh yang signifikan.

======================================================================================================================================

The rapid growth in the production and consumption of electronic devices in the last two decades has led to an increase in e-waste. Despite restrictions, the global trade in e-waste continues. In Indonesia, e-waste export and import activities still occur, including in Surabaya City, which is one of the largest consumers of electronics. However, e-waste management still faces obstacles such as the lack of specific regulations and adequate material flow data. This

study aims to describe and analyse the flow of HS 85493900 e-waste exports and imports from and to Indonesia, examine the flow of e-waste materials originating from non-battery devices and evaluate their management in the household area of Genteng Sub-district, Surabaya City. This research was conducted by collecting secondary data on the export and import activities of e-waste HS 85493900. Furthermore, the flow patterns of exports and imports of ewaste HS 85493900 to and from Indonesia were analysed. The research was then continued with data collection for the measurement of e-waste generation, knowledge, attitude, and behaviour of the community in e-waste management. Data collection was conducted through interviews with 200 households and secondary data searches. The data that had been collected

was then calculated for the potential generation rate (kg/year). Furthermore, to ensure the accuracy of the data and deepen the information obtained, verification was carried out using the Snowball Sampling method in the informal sector. Based on export-import data analysis of non-battery e-waste, in the period 2022-2024, Indonesia's exports (HS 85493900) were recorded at 3,349,451.93 kg, much higher than imports at 5,435 kg. In Genteng Sub-district, the potential generation of household e-waste from non-battery devices is estimated at 502,072 kg per year, with the largest contribution coming from prosperous family groups. Most people (44%) tend to manage e-waste by selling it to collectors. Community participation showed differences in the aspects of knowledge (32%), attitude (80%), and behaviour (66%), where only knowledge and attitude proved to have a significant effect on behaviour based on SEM-PLS analysis, while age, gender, and welfare level did not have a significant effect"
d2af595f032a1958c62ceea6b1545833;128038491;El vínculo entre percepción y nostalgia en el retro marketing. Estudio de caso: Gucci.;El retro marketing se ha convertido en un elemento esencial, y se ha revelado un factor clave para distintas marcas que predominan en el mercado. Desde que el término fue acuñado por Simon Reynolds, al inicio del siglo XXI, el concepto ha evolucionado y se ha aplicado a diferentes ámbitos desde la sociología hasta el marketing moderno. El principal objetivo de este trabajo es analizar la eficacia y la percepción de la nostalgia del retro marketing en la Generación millennial, a través del estudio de caso de Gucci. Se expondrán las ventajas e inconvenientes de implementar este tipo de estrategia como el marketing de la nostalgia. A través de una metodología de análisis cuantitativo, se procedió a realizar una encuesta y de los resultados del estudio, se concluye que las emociones como la nostalgia pueden persuadir a algunos consumidores a adquirir productos que de otro modo no comprarían en absoluto y para qué un producto retro tenga éxito en el mercado deben poseer dos características: ser original e innovador.Palabras clave: Retro marketing, nostalgia, estrategia, consumidores, comunicación.<br /
d2af595f032a1958c62ceea6b1545833;157179620;Retromarketing: conceptos, factores determinantes, estrategias y ámbitos de aplicación;"[Abstract] Retromarketing, also known as nostalgia marketing, is a strategy/activity that ""uses the past to sell in the present"". Its growth has been exponential in recent years, both in academia and in business praxis. The objective of this paper is to carry out a theoretical review on this topic, and for this it extends in its essential terminology, in the determining factors of retro/vintage demand, in the most relevant strategies, and in the specific areas of application. of retromarketing[Resumen] El Retromarketing, también conocido como marketing de nostalgia, es una estrategia/actividad que “emplea el pasado para vender en el presente”. Su crecimientro ha sido exponencial en los últimos años, tanto en la academia como en la praxis empresarial. El objetivo del presente trabajo es llevar a cabo una revisión teórica sobre este motivo, y para ello se extiende en su terminología esencial, en los factores determinantes de la demanda retro/vintage, en las estrategias más relevantes, y en los ámbitos específicos de aplicación del retromarketin"
d2af595f032a1958c62ceea6b1545833;160240932;O retro está na moda, na música e nas estratégicas de marketing: estudo de caso do regresso dos D`ZRT;"O marketing de nostalgia traduz-se numa poderosa ferramenta utilizada nas estratégias de comunicação e tem como objetivo despertar nos consumidores sentimentos e lembranças do passado, de forma a criar uma conexão emocional com os mesmos. Ao apelar às emoções positivas associadas a períodos anteriores, o marketing de nostalgia procura fortalecer a ligação entre uma marca e o seu público-alvo, estabelecendo um vínculo duradouro e significativo. O regresso da banda D'ZRT, após uma pausa de 12 anos, despertou nos fãs um grande interesse e entusiasmo. Foi através de uma estratégia de comunicação que envolveu o uso do marketing de nostalgia que a banda anunciou o regresso e comunicou, durante meses, com os consumidores em diversos meios de comunicação. A presente dissertação propõe-se a verificar o impacto que o marketing de nostalgia teve no sucesso do regresso dos D'ZRT. Para efetuar o estudo, escolheu-se a metodologia quantitativa, dado que foi aplicado um inquérito por questionário com 390 respostas válidas. Os resultados do questionário revelaram uma relação positiva entre o uso do marketing de nostalgia e os construtos estudados: brand love, memória afetiva, redes sociais, reação emocional e intenção de compra. Desta forma, concluiu-se que o uso da nostalgia como ferramenta de marketing foi uma escolha eficaz para despertar sentimentos e emoções fortes no público. Esta investigação contribui para o conhecimento académico mais vasto que relaciona o marketing de nostalgia utilizado como estratégia de comunicação no regresso de uma banda, bem como oferece insights para os profissionais de marketing, gestores de marcas e artistas que procuram relembrar o passado numa era de constante evolução cultural e tecnológica.Nostalgia marketing is a powerful tool used in communication strategies and aims to evoke feelings and memories of the past in consumers, thus creating an emotional connection with them. By tapping into the positive emotions associated with earlier periods, nostalgia marketing seeks to strengthen the bond between a brand and its target audience, establishing a lasting and meaningful connection. The return of the D'ZRT band, after a 12 year break, sparked great interest and enthusiasm among fans. It was through a communication strategy involving the use of nostalgia marketing that the band announced its return and engaged with consumers across various media outlets for months. This dissertation seeks to exp lore the effects of nostalgia marketing on the success of the D'ZRT's return. To conduct the study, a quantitative methodology was chosen, as a questionnaire survey with 390 valid responses was performed . The questionnaire results revealed a positive relationship between the use of nostalgia marketing and the constructs studied: brand love, affective memory, social media, emotional reaction, and purchase intention. Thus, it was concluded that leveraging n ostalgia as a marketing tool was an effective tool in evoking strong feelings and emotions in the audience.
This research contributes to broader academic knowledge linking nostalgia marketing as a communication strategy in a band's return, while also providing insights for marketing professionals, brand managers, and artists seeking to evoke the past in an era o f constant cultural and technological evolution"
d2af595f032a1958c62ceea6b1545833;310729285;A nostalgia como estratégia no marketing digital: o impacto das campanhas da marca NOS nas gerações Y e Z;"A nostalgia está cada vez mais presente nas estratégias de marketing digital, especialmente quando o objetivo é criar uma ligação emocional com o público. Este trabalho teve como principal objetivo analisar o impacto da nostalgia nas campanhas digitais da NOS junto das gerações Millennial e Z, através da análise de conteúdos no Instagram. Para isso, foi adotada uma abordagem mista e multidimensional que combinou análise semiótica, análise de sentimentos e dados de interação das publicações.
Os resultados demonstram que as campanhas com referências ao passado geraram mais interações e envolvimento emocional do que aquelas que não recorreram a esse tipo de apelo. A análise semiótica evidenciou que os elementos visuais, textuais e sonoros remetem a memórias culturais partilhadas, fortalecendo a ligação entre a marca e o público.
Para além de apresentar resultados empíricos, este estudo oferece contributos relevantes para a área do marketing digital em Portugal, onde a utilização da nostalgia ainda é pouco explorada. Destaca-se a análise comparativa entre campanhas nostálgicas e não nostálgicas da mesma marca, assim como a adaptação de um dicionário empírico de nostalgia para português, o que permitiu aprofundar a análise de sentimentos. Ao integrar diferentes áreas de conhecimento como comunicação, marketing, sociologia e semiótica, o estudo proporciona uma visão mais abrangente sobre o impacto da nostalgia e reforça o seu potencial como estratégia emocional no marketing digital"
d6e9712bf4d78dc25582d46273456358;305713907;Reading fake news in New High School textbooks: towards a two-sided answerability;"A Base Nacional Comum Curricular (Brasil, 2018), documento norteador da implementação do Novo Ensino Médio, prescreve o desenvolvimento de competências voltadas à apreciação ética e estética da informação e da opinião à disciplina de Língua Portuguesa. Três dos sete volumes únicos aprovados pelo Programa Nacional do Livro e do Material Didático 2021 organizam unidades e capítulos com o tema fake news e/ou pós verdade, respondendo, cada um a seu modo, à prescrição da BNCC: Estações Língua Portuguesa: rotas de atuação social (Barros et al., 2020); Interação: Português (Sette et al., 2020); e Ser protagonista: a voz das juventudes. Língua Portuguesa (Moreno et al., 2020). Nesta tese, o objetivo geral é analisar que conhecimento se propõe construir nesses três volumes únicos para preparar o estudante para se posicionar diante das fake news e da pós-verdade. Foram analisadas quatro seções de leitura. A fundamentação teórico-metodológica apoia-se nos conceitos bakhtinianos de arquitetônica (Bakhtin, 2011 [1919], 2017 [1919-1921], 2023 [1922-1924]) e de cronotopo (Bakhtin, 2018 [1937-1938], 2018 [1973], 2023 [1922-1924]), com os quais se busca alcançar dois objetivos específicos: (i) identificar finalidades de leitura que orientam as seções dos livros  didáticos do NEM; (ii) examinar como espaços-tempos-valores são articulados no  encaminhamento didático dado à leitura das coletâneas, de modo a propiciar um conhecimento ao estudante que o prepara para se posicionar frente a esse fenômeno. Como resultado, identificamos que, nas seções de Barros et al. (2020), prevalece uma concepção de leitura orientada pela identificação de vestígios que remetem a uma realidade unívoca do fato e do fake, a ser reconstruída pelo estudante nas atividades propostas. Essa reconstrução busca aplicar um saber supostamente atemporal, a-espacial e avalorativo, com vistas à distinção entre fato e fake no mundo da vida (Bakhtin, 2017 [1919-1921]). Na seção de Sette et al. (2020), a leitura também é concebida como um processo de identificação e reconstrução de uma realidade única das fake news, contraposta tanto ao saber científico como à linguagem jornalística, conferindo à leitura um papel técnico de possibilitar a aplicação de um conhecimento espaço-tempo  valorativamente objetivo para identificar as fake news. Já na seção de Moreno et al. (2020), a leitura assume um caráter  comparativo, voltado à análise de dois regimes de verdade: um, plural e factual; o outro, simplificado e forjado pelos mass media. Nesse caso, a leitura permite a construção de um conhecimento espaço-tempo-valorativamente autônomo que permite opor se às fake news e à pós-verdade. Apesar das diferenças entre as propostas, os três livros didáticos compartilham um traço comum: oferecem ao estudante mecanismos de distanciamento interpretativo que o isentam de assumir uma responsabilidade bidirecional (Bakhtin, 2017 [1919-1921]) por aquilo que lê - tanto no mundo da cultura quanto no mundo da vida. Finalmente, a análise das propostas de leitura desenvolvida aponta para a necessidade de uma base sistemático-filosófica (Bakhtin, 2014 [1924]) no ensino da leitura de fake news, que a compreenda como ato ético concretizado no acontecimento do ser leitor; e na elaboração, análise e avaliação das propostas de leitura de livros didáticos, que evidencie espaços-tempos valores na singularidade verboideológica do ensino da leitura. Deve-se voltar o olhar, assim, não só para o que é apresentado, mas para como é apresentado, modo que implica espaços tempos-valores nos quais se concretiza o conhecimento que se propõe construir no ensino e que lhe dão vida no diálogo exterior e no diálogo infinito (Souza, 2024)Base Nacional Comum Curricular (Brazil, 2018), guiding document for the New High School Curriculum implementation, prescribes the development of competencies related to the ethical and aesthetic evaluation of information and opinion within the Portuguese Language teaching. Three of the seven textbooks approved by Programa Nacional do Livro e do Material Didático 2021 organize units and chapters around the theme of fake news and/or post-truth, each responding in its own way to the BNCC\'s directive: Estações Língua Portuguesa: rotas de atuação social (Barros et al., 2020); Interação: Português (Sette et al., 2020); and Ser protagonista: a voz das juventudes (Moreno et al., 2020). In this thesis, the central objective is to analyze what kind of knowledge is proposed for construction in these three textbooks\' reading instructions to prepare the student to take a stance on fake news and post-truth. Four reading sections were analyzed. The theoretical-methodological foundation is based on Bakhtinian concepts of architectonics (Bakhtin, 2011 [1919], 2017 [1919-1921], 2023 [1922-1924]) and chronotope (Bakhtin, 2018 [1937-1938], 2018 [1973], 2023 [1922-1924]), with which we seek to achieve two key objectives: (i) to identify the reading purposes that guide the sections; and (ii) to examine how spaces-times-values are articulated in the didactic approach to reading in the textbooks, in order to provide students with the knowledge that prepares them to take a stance on the phenomenon. As a result, we identified that, in Barros et al. (2020) sections, predominates a reading concept guided by the identification of traces that refer to a univocal reality of fact and fake, to be reconstructed by the student in the proposed activities. This reconstruction seeks to apply a supposedly atemporal, aspacial, and avalorative  knowledge, aiming at a distinction between fact and fake in the world of life (Bakhtin, 2017  [1919-1921]). In Sette et al. (2020) section, reading is also conceived as a process of identifying and reconstructing a fake news unique reality, contrasted with both scientific knowledge and journalistic language, granting reading a technical role in enabling the application of a space time-evaluative objective knowledge to identify fake news. In contrast, in Moreno et al. (2020) section, reading takes on a comparative character, focused on the analysis of two truth regimes: one, plural and factual; the other, simplified and fabricated by the mass media. In this case, reading allows for the construction of a space-time-evaluative autonomous knowledge that enables opposition to fake news and post-truth. Despite the differences among the proposals, the three textbooks share a common characteristic: they offer students mechanisms of interpretative distancing that exempt them from assuming a two-sided answerability (Bakhtin, 2017 [1919-1921]) for what they read - both in the world of culture and in the world of life. Finally, the reading proposals analysis highlights the need for a systematic-philosophical framework (Bakhtin, 2014 [1924]) in two key areas: first, in the reading instructions, defining reading as an ethical act materialized in the event of being a reader; and second, in the elaboration and evaluation of didactic proposals, which must foreground the spaces-times values within the verbo-ideological singularity of reading instruction and the conception of reading that guides it. Thus, attention must shift not only to what is presented but also to how  it is presented - a mode that implicates the spaces-times-values in which the knowledge  proposed for construction in reading instruction is actualized and given life in the exterior  dialogue and the infinite dialogue (Souza, 2024"
d6e9712bf4d78dc25582d46273456358;313221671;Les fake news comme brèche spatio-temporelle dans l’actualité événementielle;International audienceFor more than a century, journalists and media oligopolies have had a stranglehold on the temporality of news events. Fake news is shaking up this space-time continuum and calling into question freedom of expression and ethical standards in journalism. Acommunication has become a strategic tool for disinformation, feeding a stream of manipulative content. The metronome of Habermas' public sphere has imploded into a multitude of belief spheres, filter bubbles that accompany the digital monads orbiting in the digital galaxy.Durant plus d’un siècle, les journalistes et les oligopoles médiatiques ont eu une mainmise sur la temporalité de l’actualité événementielle. Les fake news viennent ébranler cet espace-temps et questionner la liberté d’expression et les normes déontologiques de l’information. L’acommunication est devenue un outil stratégique de désinformation, nourrissant un flux de contenus manipulatoires. Le métronome de l’espace public habermassien a fini par imploser en une multitude de sphères de croyances, ces filter bubbles qui accompagnent les monades numériques qui orbitent dans la galaxie digitale
