qid;docid;title;abstract
8cc85d9d1d5424fb44a6e3c22ecc8a12;309157764;Analysis of the determinants of price differences in the real estate market in Bratislava and its surroundings;This thesis examines the determinants of regional differences in property prices in Slovakia, with a focus on the Bratislava region, over the period 2005–2023. Using data from the Statistical Office of the Slovak Republic (Datacube), we conducted regression analyses and a panel model with both fixed and random effects to identify the impact of macroeconomic indicators (GDP per capita, unemployment rate, economic activity, interest rates), demographic variables (number of marriages), and supply factors (number of completed apartments) on the average apartment price per square meter. All quantitative analyses are conducted in program R.Táto diplomová práca skúma determinanty regionálnych rozdielov v cenách nehnuteľností na Slovensku, so zameraním na Bratislavský kraj, v období rokov 2005– 2023. S využitím údajov zo Štatistického úradu SR (Datacube) sme realizovali regresné analýzy a panelový model s fixnými aj náhodnými efektmi, aby sme identifikovali vplyv makroekonomických ukazovateľov (HDP na obyvateľa, miera nezamestnanosti, ekonomická aktivita, úrokové sadzby), demografických premenných (počet uzavretých manželstiev) a faktorov ponuky (počet dokončených bytov) na priemernú cenu bytov za m². Kvantitatívne analýzy boli realizované v prostredí R.Tato diplomová práce zkoumá determinanty regionálních rozdílů v cenách nemovitostí na Slovensku, se zaměřením na Bratislavský kraj, v období let 2005–2023. S využitím údajů ze Statistického úřadu SR (Datacube) jsme realizovali regresní analýzy a panelový model s fixními i náhodnými efekty, abychom identifikovali vliv makroekonomických ukazatelů (HDP na obyvatele, míra nezaměstnanosti, ekonomická aktivita, úrokové sazby), demografických proměnných (počet uzavřených manželství) a faktorů nabídky (počet dokončených bytů) na průměrnou cenu bytů za m². Kvantitativní analýzy byly provedeny v prostředí R
8cc85d9d1d5424fb44a6e3c22ecc8a12;309158100;Contemporary Hungarian Theatre in Southwestern Slovakia;Tato bakalářská práce zkoumá současný stav divadelnictví v maďarské menšině na jihozápadním Slovensku. Hlavní část výzkumu se zaměřuje na případové studie tří klíčových institucí: divadla Jókai v Komárnu, Tanečního divadla Ifjú Szivek a nezávislé divadelní platformy Trepp. Práce se zaměřuje na kulturní, organizační a finanční podmínky ovlivňující provoz těchto institucí a snaží se identifikovat současné výzvy, příležitosti a omezení, které formují jejich aktivity. Výzkum také reflektuje vztah mezi menšinovou a majoritní (slovenskou) divadelní scénou a zkoumá umělecký potenciál, který nabízí dvojjazyčnost. Pro poskytnutí širšího kontextu se věnuje také maďarské divadelní činnosti v oblasti mezi Bratislavou a Komárnem. Studie využívá kombinaci kvalitativních metod, včetně polostrukturovaných rozhovorů s klíčovými zástupci vybraných divadel a analýzy relevantních dokumentů.This Bachelor's thesis examines the current state of theatre within the Hungarian minority in southwestern Slovakia. The core of the research consists of case studies of three key institutions: the Jókai Theatre in Komárno, the Ifjú Szivek Dance Theatre, and the independent theatre platform Trepp. The thesis focuses on the cultural, organizational, and financial conditions influencing the operation of these institutions and aims to identify the current challenges, opportunities, and limitations shaping their activities. The research also reflects on the relationship between the minority and majority (Slovak) theatre scenes and explores the artistic potential offered by bilingualism. To provide broader context, attention is also given to Hungarian theatrical activity in the area between Bratislava and Komárno. The study relies on a combination of qualitative methods, including semi-structured interviews with key representatives of the selected theatres and analysis of relevant documents.Bakalárska práca sa zaoberá súčasným stavom divadelníctva maďarskej národnostnej menšiny na juhozápadnom Slovensku. Hlavným predmetom sú prípadové štúdie troch kľúčových subjektov: Jókaiho divadla v Komárne, Tanečného divadla Ifjú Szivek a divadelnej platformy Trepp. Práca sa zameriava na kultúrne, organizačné a finančné podmienky, ktoré ovplyvňujú fungovanie týchto inštitúcií, a usiluje sa identifikovať aktuálne výzvy, príležitosti a obmedzenia, ktoré formujú ich činnosť. Súčasťou výskumu je aj reflexia vzťahu medzi menšinovou a väčšinovou (slovenskou) divadelnou scénou, ako aj skúmanie možností, ktoré prináša dvojjazyčnosť v umeleckej tvorbe. Pre širší kontext je pozornosť venovaná aj maďarskej divadelnej činnosti v oblasti medzi Bratislavou a Komárnom. Výskum je realizovaný kombináciou kvalitatívnych metód, prostredníctvom pološtruktúrovaných rozhovorov s kľúčovými predstaviteľmi jednotlivých divadiel a analýzy dostupných dokumentov
8cc85d9d1d5424fb44a6e3c22ecc8a12;312804781;Niezaangażowany obserwator? Słowacja wobec Inicjatywy Trójmorza (2015-2024);The Three Seas Initiative (3SI) is a relatively new format of regional cooperation in Central Europe focused on economic cooperation. From the beginning, Slovakia has been a member of the initiative, but it is one of the least involved participating countries in the Three Seas cooperation. This is due to many international and domestic factors. Bratislava, above all, does not see any added value in the 3SI and focuses primarily on EU funds in its regional development. The format is also perceived as aimed at EU unity and a counterweight to German dominance. The new US administration of Donald Trump and its approach to the 3SI provides an opportunity to change the position of the Slovak authorities. The current president of Slovakia, Peter Pellegrini, may pursue a similarly new policy towards the format. The article presents the conditions for Slovakia's functioning in the 3SI in the years 2015-2024, state and expert entities involved in the Three Seas cooperation, public discourse on the 3SI and the most important projects involving the Slovak side. An attempt was also made to answer the question about the reasons for Slovakia's distancing itself from this format of regional cooperation and the possibilities of overcoming this reluctance.Inicjatywa Trójmorza (Three Seas Initiative, 3SI) to stosunkowo nowy format współpracy regionalnej w Europie Środkowej skoncentrowany na współpracy ekonomicznej. Od początku w jego skład wchodzi Słowacja, która zalicza się jednak do grupy najmniej zaangażowanych we współpracę trójmorską państw uczestniczących. Jest to uwarunkowane wieloma czynnikami międzynarodowymi i wewnątrzkrajowymi. Bratysława przede wszystkim nie widzi w 3SI żadnej wartości dodanej i stawia w swoim rozwoju regionalnym przede wszystkim na fundusze UE. Format jest także postrzegany jako wymierzony w jedność UE i przeciwwagę dla dominacji Niemiec. Szansę na zmianę stanowiska władz słowackich stanowi nowa administracja amerykańska Donalda Trumpa i jej podejście do 3SI. Podobnie nową politykę wobec formatu może prowadzić obecny prezydent Słowacji Peter Pellegrini. W artykule przedstawione zostały uwarunkowania funkcjonowania Słowacji w 3SI w latach 2015-2024, podmioty państwowe i eksperckie zajmujące się współpracą trójmorską, dyskurs publiczny o 3SI i najważniejsze projekty z udziałem strony słowackiej. Podjęta została również próba odpowiedzi na pytanie o przyczyny dystansowania się Słowacji od tego formatu współpracy regionalnej i możliwości przełamania tej niechęci
93552e2eb156f5c55161c41a17f2a01a;292795452;Penerapan Layanan Konseling Individual dengan Menggunakan Pendekatan Gestalt Untuk Mengurangi Stres Akademik Siswa di SMKN 1 Percut Sei Tuan;"This study was conducted by researchers to address the issue of academic stress experienced by students at SMKN 1 Percut Sei Tuan. Academic stress is a state of pressure arising from school demands, such as numerous assignments and high expectations from teachers or the environment. This pressure can affect students' behavior in learning and impact both their academic performance and mental health.
The purpose of this research is to reduce students' academic stress by implementing individual counseling services using the Gestalt approach. The Gestalt approach was chosen because it focuses on students' self-awareness, which is expected to help them view problems holistically and develop responsibility in addressing these issues.
This study is a qualitative research with a descriptive approach, involving three students as subjects. Data were collected through observations and interviews to identify the factors of academic stress experienced by students and to evaluate the effectiveness of the counseling provided. Data analysis was carried out through reduction, data presentation, and conclusion drawing.
The research findings indicate that individual counseling services using the Gestalt approach significantly reduce students' academic stress levels. Before counseling, students exhibited high-stress symptoms that affected their behavior and academic outcomes. After receiving counseling, they became more capable of managing their time and meeting academic demands more effectively.
Penelitian ini dilakukan oleh peneliti untuk mengatasi permasalahan stres akademik yang dialami siswa di SMKN 1 Percut Sei Tuan. Stres akademik adalah kondisi tekanan yang muncul akibat tuntutan sekolah, seperti banyaknya tugas dan ekspektasi yang tinggi dari guru atau lingkungan. Tekanan ini dapat memengaruhi perilaku siswa dalam belajar dan berdampak pada hasil akademik serta kesehatan mental mereka.
Penelitian ini bertujuan mengurangi stres akademik siswa dengan menerapkan layanan konseling individual menggunakan pendekatan Gestalt. Pendekatan Gestalt dipilih karena berfokus pada kesadaran diri siswa, yang diharapkan dapat membantu mereka melihat masalah secara menyeluruh dan mengembangkan tanggung jawab untuk mengatasi permasalahan tersebut.
Penelitian ini merupakan penelitian kualitatif dengan pendekatan deskriptif, melibatkan tiga siswa sebagai subjek. Data diperoleh melalui observasi dan wawancara untuk mengidentifikasi faktor-faktor stres akademik yang dialami siswa dan untuk mengevaluasi efektivitas konseling yang diberikan. Analisis data dilakukan melalui proses reduksi, penyajian data, dan penarikan kesimpulan.
Hasil penelitian menunjukkan bahwa layanan konseling individual dengan pendekatan Gestalt mampu mengurangi tingkat stres akademik siswa secara signifikan. Sebelum layanan konseling, siswa menunjukkan gejala stres tinggi yang berdampak pada perilaku dan hasil belajar. Setelah menerima konseling, mereka mulai mampu mengatur waktu dan memenuhi tuntutan akademik dengan lebih baik"
93552e2eb156f5c55161c41a17f2a01a;298521712;Estrés académico en estudiantes de práctica clínica del consultorio psicológico solidario de la Universidad Cooperativa de Colombia campus Villavicencio;"Este estudio investiga los niveles de estrés académico en estudiantes de psicología de la Universidad Cooperativa de Colombia, campus Villavicencio, un tema de creciente relevancia en la educación superior, particularmente en la formación clínica de psicólogos, el objetivo principal fue analizar los niveles de estrés académico y describir los síntomas asociados, empleando el Inventario SISCO SV-21 como herramienta para evaluar estresores, síntomas y estrategias de afrontamiento. Metodológicamente se adoptó un enfoque cuantitativo y un diseño no experimental descriptivo, la recolección de datos se realizó a través del Inventario SISCO-SV 21, aplicado a una muestra de 57 estudiantes de práctica clínica del consultorio psicológico. Los resultados evidenciaron que la mayoría de los estudiantes universitarios (57.89%) experimentan estrés académico severo, influenciado por factores sociodemográficos como edad, 
género, nivel socioeconómico y las condiciones de desplazamiento desde el lugar de origen, a lo largo del análisis, se confirmó que el estrés académico es el resultado de múltiples factores que convergen en el estudiante universitario: exigencias institucionales, falta de tiempo, presión por resultados, condiciones económicas precarias, responsabilidades familiares y laborales, y limitada 
preparación emocional para enfrentar situaciones clínicas reales.His study investigates the levels of academic stress in psychology students at the Cooperativa University of Colombia, Villavicencio campus, a topic of increasing relevance in higher education, particularly in the clinical training of psychologists. The main objective was to analyze the levels of academic stress and describe the associated symptoms, employing the SISCO SV-21 Inventory as a tool to evaluate stressors, symptoms, and coping strategies. Methodologically, a quantitative approach and a non-experimental descriptive design were adopted. Data collection was carried out through the SISCO-SV 21 Inventory, applied to a sample of 57 clinical practice students from the psychological counseling center. The results showed that the majority of university students (57.89%) experience severe academic stress, influenced by sociodemographic factors such as age, gender, socioeconomic level, and displacement conditions from their place of origin. Throughout the analysis, it was confirmed that academic stress is the result of multiple factors that converge in the university student: institutional demands, lack of time, pressure for results, precarious economic conditions, family and work responsibilities, and limited emotional preparation to face real clinical situations.1. Resumen. -- 2. Abstract. -- 3. Introducción. -- 4. Planteamiento del problema. -- 5. Justificación. -- 6. Objetivos. -- 7. Marco teórico. -- 8. Marco empírico. --9. Metodología. --10. Resultados. -- 11. Discusiones. -- 12. Conclusiones. -- 13. Referencias.PregradoPsicólog"
93552e2eb156f5c55161c41a17f2a01a;312185884;Dampak perceraian orang tua terhadap prestasi akademik siswa Kelas VIII di MTs Al Maarif Desa Bocek Kecamatan Karangploso Kabupaten Malang;"INDONESIA:



Masa remaja merupakan masa transisi yang penuh tantangan dan gejolak emosi, sehingga kehadiran dan peran orang tua sangat krusial dalam membentuk karakter dan prestasi anak, termasuk dalam pendidikan formal. Ketika perceraian terjadi, stabilitas emosi anak dan perhatian dari kedua orang tua seringkali terganggu, yang pada akhirnya dapat memengaruhi proses belajar dan hasil akademiknya. Penelitian ini bertujuan untuk menganalisis secara mendalam dampak perceraian orang tua terhadap prestasi akademik siswa kelas VIII MTs Al Maarif, Desa Bocek, Kecamatan Karangploso, Kabupaten Malang. Perceraian merupakan fenomena sosial yang berkembang dengan konsekuensi psikologis dan sosial yang kompleks, terutama bagi remaja.



Penelitian ini menggunakan pendekatan kualitatif deskriptif, dengan pengumpulan data melalui observasi langsung, wawancara mendalam dengan siswa, guru bimbingan dan konseling (BK), wali kelas, dan dokumentasi. Subjek penelitian adalah siswa kelas delapan dari keluarga yang mengalami perceraian. Para peneliti berupaya mengeksplorasi pengalaman subjektif siswa dalam menghadapi perceraian orang tua dan mengkaji hubungannya dengan prestasi akademik, kesejahteraan mental dan emosional, serta dukungan sosial yang mereka terima.



Hasil penelitian menunjukkan bahwa perceraian orang tua berdampak negatif terhadap sebagian besar siswa, baik secara akademik maupun psikologis. Beberapa siswa menunjukkan penurunan nilai akademik yang signifikan, kesulitan berkonsentrasi di kelas, dan kehilangan minat belajar. Secara psikologis, siswa mengalami berbagai gangguan, seperti kesedihan yang berkepanjangan, rasa takut ditinggalkan, kecemasan, rasa malu di sekitar teman, dan rasa percaya diri yang rendah. Namun, dampak-dampak ini tidak seragam. Beberapa siswa mampu mengatasi tekanan-tekanan ini dengan menunjukkan ketahanan emosional yang kuat, terutama berkat dukungan dari sekolah, teman sebaya, atau keluarga besar mereka yang peduli dengan situasi mereka.



Kesimpulan dari penelitian ini adalah bahwa perceraian orang tua dapat berdampak signifikan terhadap prestasi akademik siswa, tetapi tingkat dampak ini sangat bergantung pada kepribadian anak, strategi koping yang mereka gunakan, dan tingkat dukungan dari lingkungan mereka. Peran sekolah, khususnya konselor bimbingan dan wali kelas, sangat penting dalam memberikan dukungan psikologis dan akademik kepada siswa yang mengalami krisis keluarga. Dengan perhatian dan pendekatan yang tepat, siswa dari keluarga yang bercerai tetap memiliki kesempatan yang sama untuk meraih keberhasilan akademik dan berkembang secara optimal di lingkungan pendidikan.



ENGLISH:



Adolescence is a transitional period full of challenges and emotional upheaval, so the presence and role of parents are crucial in shaping children's character and achievements, including in formal education. When divorce occurs, children's emotional stability and attention from both parents are often disrupted, which can ultimately affect their learning process and academic outcomes. This study aims to analyze in depth the impact of parental divorce on the academic achievement of eighth grade students at MTs Al Maarif, Bocek Village, Karangploso District, Malang Regency. Divorce is a growing social phenomenon with complex psychological and social consequences, especially for adolescents.



This study used a descriptive qualitative approach, collecting data through direct observation, in-depth interviews with students, guidance and counseling (BK) teachers, homeroom teachers, and documentation. The subjects were eighth-grade students from families experiencing divorce. The researchers sought to explore the students' subjective experiences of coping with parental divorce and examine its relationship to academic achievement, mental and emotional well-being, and the social support they received.



The results showed that parental divorce negatively impacted the majority of students, both academically and psychologically. Some students exhibited a significant decline in academic grades, difficulty concentrating in class, and a loss of interest in learning. Psychologically, students experienced various disturbances, such as prolonged sadness, fear of abandonment, anxiety, embarrassment around friends, and low self-confidence. However, these impacts were not uniform. Some students were able to overcome these pressures by demonstrating strong emotional resilience, primarily due to the support of their school, peers, or extended family who cared about their situation.



The conclusion of this study is that parental divorce can have a significant impact on students' academic achievement, but the extent of this impact depends heavily on the child's personality, the coping strategies they use, and the level of support from their environment. The role of schools, particularly guidance counselors and homeroom teachers, is crucial in providing psychological and academic support to students experiencing family crises. With the right attention and approach, students from divorced families still have equal opportunities to achieve academic success and develop optimally in the educational environment.



ARABIC:



تُعدّ مرحلة المراهقة فترة انتقالية مليئة بالتحديات والاضطرابات العاطفية، لذا فإن وجود الوالدين ودورهما حاسمان في تشكيل شخصية الطفل وإنجازاته، بما في ذلك في التعليم الرسمي. عند حدوث الطلاق، غالبًا ما يضطرب الاستقرار العاطفي للأطفال واهتمام كلا الوالدين بهم، مما قد يؤثر في النهاية على عملية تعلمهم ونتائجهم الأكاديمية. تهدف هذه الدراسة إلى تحليل متعمق لأثر طلاق الوالدين على التحصيل الدراسي لطلاب الصف الثامن في مدرسة المعارف المتوسطة، قرية بوتشيك، مقاطعة كارانغبلوسو، مقاطعة مالانغ. يُعد الطلاق ظاهرة اجتماعية متنامية تحمل عواقب نفسية واجتماعية معقدة، لا سيما على المراهقين.



اعتمدت هذه الدراسة على منهج وصفي نوعي، وجمعت البيانات من خلال الملاحظة المباشرة، والمقابلات المعمقة مع الطلاب، ومعلمي التوجيه والإرشاد، ومعلمي الصفوف، والتوثيق. شملت الدراسة طلاب الصف الثامن من أسر تعاني من الطلاق. سعى الباحثون إلى استكشاف التجارب الذاتية للطلاب في التعامل مع طلاق الوالدين، ودراسة علاقته بالتحصيل الدراسي، والصحة النفسية والعاطفية، والدعم الاجتماعي الذي تلقوه.



أظهرت النتائج أن طلاق الوالدين أثر سلبًا على غالبية الطلاب، أكاديميًا ونفسيًا. أظهر بعض الطلاب انخفاضًا ملحوظًا في الدرجات الأكاديمية، وصعوبة في التركيز في الفصل، وفقدانًا للاهتمام بالتعلم. من الناحية النفسية، عانى الطلاب من اضطرابات مختلفة، كالحزن المطول، والخوف من الهجر، والقلق، والشعور بالحرج من الأصدقاء، وانخفاض الثقة بالنفس. ومع ذلك، لم تكن هذه الآثار موحدة. فقد تمكن بعض الطلاب من التغلب على هذه الضغوط بإظهار مرونة عاطفية قوية، ويعود ذلك أساسًا إلى دعم المدرسة أو الأقران أو العائلة الممتدة التي اهتمت بحالتهم.



وخلصت هذه الدراسة إلى أن طلاق الوالدين يمكن أن يكون له تأثير كبير على التحصيل الدراسي للطلاب، إلا أن مدى هذا التأثير يعتمد بشكل كبير على شخصية الطفل، واستراتيجيات التكيف التي يستخدمها، ومستوى الدعم من بيئته. ويُعد دور المدارس، وخاصةً مرشدي التوجيه ومعلمي الصفوف، بالغ الأهمية في تقديم الدعم النفسي والأكاديمي للطلاب الذين يمرون بأزمات أسرية. ومع الاهتمام والنهج المناسبين، لا يزال الطلاب من الأسر المطلقة يتمتعون بفرص متساوية لتحقيق النجاح الأكاديمي والتطور الأمثل في البيئة التعليمي"
