qid;docid;title;abstract
6513b320bfbcd0ed11d192b17f985131;172226024;Inteligencia emocional y desempeño académico en los estudiantes del quinto grado en una institución educativa pública, Tumbes, 2024;"The research aimed to determine the relationship between emotional intelligence and academic performance among fifth-grade students in a public school in Tumbes, Peru, in 2024. It aligns with SDG 4: Quality Education by addressing factors that influence learning outcomes. The specific objectives included analyzing the relationship between the dimensions of emotional intelligence—emotional attention, emotional clarity, and emotion repair—and academic performance.
This quantitative, basic, non-experimental study employed a correlational causal design. The population consisted of 386 students, with a sample of 56 participants. The TMMS-24 test was used to assess emotional intelligence, while academic performance was evaluated through progress reports.
The results indicated no significant relationship between emotional intelligence or its specific dimensions and academic performance (p &gt; 0.05). The conclusions highlight that academic performance is not directly influenced by emotional intelligence but rather by contextual and mediating factors, such as motivation and socio-emotional environments.La investigación tuvo como objetivo principal determinar la relación entre la inteligencia emocional y el rendimiento académico en estudiantes de quinto grado de una institución educativa pública en Tumbes durante 2024, alineándose con el ODS 4: Educación de calidad, al buscar mejorar la comprensión de factores que influyen en el aprendizaje. Los objetivos específicos incluyeron analizar la relación entre las dimensiones de la inteligencia emocional: atención emocional, claridad emocional y reparación de emociones, y el rendimiento académico.
El estudio, de tipo cuantitativo, básico y no experimental, utilizó un diseño correlacional causal. La población estuvo conformada por 386 estudiantes, de los cuales 56 participaron como muestra. Se aplicaron el test TMMS-24 para medir la inteligencia emocional y los informes de progreso académicos para evaluar el rendimiento.
Los resultados mostraron que no existe una relación significativa entre la inteligencia emocional (ni sus dimensiones específicas) y el rendimiento académico (p &gt; 0.05). Las conclusiones subrayan que el rendimiento académico no está directamente influido por la inteligencia emocional, sino por factores contextuales y mediadores, como la motivación o el entorno socioemocional"
6513b320bfbcd0ed11d192b17f985131;301433518;REALIDADES TEÓRICAS SOBRE LA INTELIGENCIA EMOCIONAL PARA EL DESARROLLO ACADÉMICO DE LOS ESTUDIANTES;Theoretical insights into the development of emotional intelligence (EI) in relation to students' academic performance highlight the importance of understanding emotional skills as fundamental components of the learning process. From early research, it has been established that EI not only influences psychological well-being but also has a direct impact on cognitive abilities and the management of school situations. More broadly, this article aims to reflect from a theoretical perspective on the development of emotional intelligence in promoting academic development. As an essay, empirical evidence supports the idea that students with higher levels of emotional intelligence tend to perform better academically. Studies show that these students are more resilient in the face of difficulties, maintain a positive attitude toward learning, and are less prone to disruptive behaviors. Furthermore, their ability to regulate their emotions allows them to cope more effectively with stressful or challenging situations in the school setting, which translates into greater concentration and persistence in their academic tasks. Consequently, promoting emotional development becomes a key strategy for enhancing academic performance.Las realidades teóricas sobre el desarrollo de la inteligencia emocional (IE) en relación con el rendimiento académico de los estudiantes destacan la importancia de comprender las habilidades emocionales como componentes fundamentales del proceso de aprendizaje. Desde las primeras investigaciones, se ha establecido que la IE no solo influye en el bienestar psicológico, sino que también tiene un impacto directo en las capacidades cognitivas y en la gestión de situaciones escolares. En un sentido más amplio, el presente artículo se enmarca en el objetivo de reflexionar desde una perspectiva teórica sobre el desarrollo de la inteligencia emocional en la promoción del desarrollo académico. Al ser un ensayo la evidencia empírica respalda que los estudiantes con mayor nivel de inteligencia emocional tienden a presentar mejores resultados académicos. Estudios muestran que estos alumnos poseen mayor resiliencia ante dificultades, mantienen una actitud positiva hacia el aprendizaje y tienen menor propensión a conductas disruptivas. Además, su capacidad para regular sus emociones les permite afrontar con mayor eficacia situaciones estresantes o desafiantes en el contexto escolar, lo cual se traduce en una mayor concentración y persistencia en sus tareas académicas. En consecuencia, promover el desarrollo emocional se convierte en una estrategia clave para potenciar el rendimiento escolar
652d873a275fd4ba0504d141cf387c59;275699593;ഡിജിറ്റൽ മൈക്രോ-ഇടപെടലുകൾ: സോഷ്യൽ മീഡിയ തരുന്ന താൽക്കാലിക സന്തോഷവും ദീർഘകാല വൈകാരിക പ്രശ്നങ്ങളും;സോഷ്യൽ മീഡിയയിൽ പോസ്റ്റുകൾ ലൈക്ക് ചെയ്യുക, നോട്ടിഫിക്കേഷനുകൾ കാണുക, ചെറിയ വീഡിയോകൾ നോക്കുക തുടങ്ങിയ ചെറിയ ഡിജിറ്റൽ ഇടപെടലുകൾ, കോവിഡ്-19ന് ശേഷം വളരെ സാധാരണമായി. ഈ പേപ്പർ ഒരു ആശയം മുന്നോട്ടുവെക്കുന്നു. ഇത്തരം ഇടപെടലുകൾ ആളുകളെ തൽക്ഷണം സന്തോഷിപ്പിക്കും. പക്ഷേ, ദീർഘകാലത്തിൽ ശ്രദ്ധക്കുറവ്, ദേഷ്യം, വികാരങ്ങൾ നിയന്ത്രിക്കാനുള്ള ബുദ്ധിമുട്ട് തുടങ്ങിയ പ്രശ്നങ്ങൾ ഉണ്ടാക്കാം. ഈ ഫലങ്ങൾ മസ്തിഷ്കത്തിലെ വീക്കം (inflammation) മൂലമാകാം. PCOS, പോഷകക്കുറവ്, മാനസിക പ്രശ്നങ്ങൾ, തൈറോയ്ഡ് രോഗങ്ങൾ, മയക്കുമരുന്ന് ഉപയോഗ ചരിത്രം തുടങ്ങിയവയുള്ളവർക്ക് ഈ പ്രശ്നങ്ങൾ കൂടുതലായിരിക്കാം. എന്നാലും, ഈ ആശയം എല്ലാവർക്കും ബാധകമാണ്. മനഃശാസ്ത്രം, ന്യൂറോസയൻസ്, ആരോഗ്യ പഠനങ്ങൾ എന്നിവയെ അടിസ്ഥാനമാക്കി, ഈ മോഡൽ സോഷ്യൽ മീഡിയയുടെ മനസ്സിനെ ബാധിക്കുന്ന ഒരു വശം വെളിവാക്കുന്നു. ഇതിന്റെ സൈദ്ധാന്തികവും ക്ലിനിക്കൽ പ്രാധാന്യവും ഭാവി പഠന ആവശ്യങ്ങളും ചർച്ച ചെയ്യുന്നു
652d873a275fd4ba0504d141cf387c59;297033226;वर्तमान सामाजिक परिप्रेक्ष्य में सोशल मीडिया का युवाओं के मानसिक स्वास्थ्य पर प्रभाव;"वर्तमान समय में सोशल मीडिया का युवाओं के जीवन में महत्वपूर्ण स्थान बन चुका है, इसने युवाओं के सामाजिक एवं व्यक्तिगत जीवन के साथ-ही-साथ मानसिक स्वास्थ्य पर भी गहरा प्रभाव डाला है। इस शोध पत्र का मुख्य उद्देश्य “वर्तमान सामाजिक परिप्रेक्ष्य में सोशल मीडिया के उपयोग एवं युवाओं के मानसिक स्वास्थ्य के बीच के संबंधों को समझने का प्रयास करना है”। विशेष रूप से, यह शोध यह मूल्यांकन करता है कि “सोशल मीडिया पर अधिक समय बिताने से युवाओं में मानसिक स्वास्थ्य समस्याएँ”, जैसेकि ‘चिंता’, ‘तनाव’, ‘अवसाद’ एवं आत्म-छवि की समस्याएँ कैसे उत्पन्न होती हैं। वास्तव में “सोशल मीडिया का अत्यधिक उपयोग युवाओं के मानसिक स्वास्थ्य पर नकारात्मक प्रभाव डालता है” । सोशल मीडिया पर अधिक समय बिताने से युवाओं के मानसिक तनाव एवं चिंता के स्तर में वृद्धि होती है; साथ-ही, सोशल मीडिया पर असल जीवन के मुकाबले आदर्श एवं अवास्तविक छवियाँ देखकर युवाओं की आत्म-छवि तथा आत्मविश्वास में कमी आती है। इस अध्ययन के माध्यम से यह निष्कर्ष निकलता है कि “सोशल मीडिया के प्रभाव को संतुलित एवं विवेकपूर्ण तरीके से उपयोग करना चाहिए, जिससे कि इसके नकारात्मक प्रभावों को कम किया जा सके”। इस शोध पत्र को विषयवस्तु विश्लेषण शोध विधि के माध्यम से तैयार किया गया है।वर्तमान समय में सोशल मीडिया का युवाओं के जीवन में महत्वपूर्ण स्थान बन चुका है, इसने युवाओं के सामाजिक एवं व्यक्तिगत जीवन के साथ-ही-साथ मानसिक स्वास्थ्य पर भी गहरा प्रभाव डाला है। इस शोध पत्र का मुख्य उद्देश्य “वर्तमान सामाजिक परिप्रेक्ष्य में सोशल मीडिया के उपयोग एवं युवाओं के मानसिक स्वास्थ्य के बीच के संबंधों को समझने का प्रयास करना है”। विशेष रूप से, यह शोध यह मूल्यांकन करता है कि “सोशल मीडिया पर अधिक समय बिताने से युवाओं में मानसिक स्वास्थ्य समस्याएँ”, जैसेकि ‘चिंता’, ‘तनाव’, ‘अवसाद’ एवं आत्म-छवि की समस्याएँ कैसे उत्पन्न होती हैं। वास्तव में “सोशल मीडिया का अत्यधिक उपयोग युवाओं के मानसिक स्वास्थ्य पर नकारात्मक प्रभाव डालता है” । सोशल मीडिया पर अधिक समय बिताने से युवाओं के मानसिक तनाव एवं चिंता के स्तर में वृद्धि होती है; साथ-ही, सोशल मीडिया पर असल जीवन के मुकाबले आदर्श एवं अवास्तविक छवियाँ देखकर युवाओं की आत्म-छवि तथा आत्मविश्वास में कमी आती है। इस अध्ययन के माध्यम से यह निष्कर्ष निकलता है कि “सोशल मीडिया के प्रभाव को संतुलित एवं विवेकपूर्ण तरीके से उपयोग करना चाहिए, जिससे कि इसके नकारात्मक प्रभावों को कम किया जा सके”। इस शोध पत्र को विषयवस्तु विश्लेषण शोध विधि के माध्यम से तैयार किया गया है"
6d1f50ca1928f230f5e90b7573fedc85;107281290;La relación entre el rendimiento universitario y la privación de sueño;Sleep deprivation is the condition of insufficient sleep, which can be chronic or acute. The effect of sleep deprivation on academic performance was investigated by applying a survey. Specifically, it was investigated: how does not sleep affect college performance. To achieve this, the parts of the brain that are related to sleep and describe the consequences caused by lack of sleep were also identified. In addition, the sleep pattern in university individuals is analyzed. Within the results, the veracity of the proposed hypothesis was evaluated, that the more rest time the students have, the better the results in their studies. However, the results of the research showed that students who sleep less time still manage to maintain acceptable results. The performance of most college students is not greatly affected by sleep deprivation, but it is better to have good sleep habits to avoid diseases that they may acquire in the future.La privación de sueño es la condición de insuficiencia de sueño, pudiendo ser crónica o aguda. Se investigó el efecto de la privación del sueño en el desempeño académico, mediante la aplicación de una encuesta. Específicamente, se investigó: cómo afecta el no dormir al rendimiento universitario. Para lograr esto, también se identificaron las partes del cerebro que se relacionan al sueño y describen las consecuencias causadas por la falta de sueño. Además, se analiza el patrón de sueño en los individuos universitarios. Dentro de los resultados se evaluó la veracidad de la hipótesis propuesta, que entre más tiempo de descanso tienen los estudiantes, mejores son los resultados en sus estudios. Sin embargo, los resultados de la investigación arrojaron que los estudiantes que duermen menos tiempo de igual manera consiguen mantener resultados aceptables. El rendimiento de la mayoría de los estudiantes universitarios no se ve alterado de gran manera por la privación de sueño, pero es mejor tener buenos hábitos de sueño, para poder evitar enfermedades que pueden adquirir en un futuro
70a7a4c11f729b8ced811befa82aa2b7;295846592;Analysis of the expression of microRNA-34c and BCL-2 gene related to apoptosis in the cerebellum of rats submitted to focal cerebral ischemia associated or not with a physical exercise model;Introdução: O acidente vascular cerebral (AVC) é um grande problema de saúde pública e é considerado uma das principais causas de morte e incapacidade em todo mundo, que, se não tratada, pode resultar em lesão neuronal. Além disso, ocorrem processos apoptóticos distantes do foco isquêmico, como exemplo, no cerebelo. Por conta da incapacidade causada pelo AVC no indivíduo, a reabilitação é necessária para evitar maiores prejuízos à saúde do paciente. Portanto, a utilização de exercício físico pode ser uma alternativa para esse problema, envolvendo exercícios passivos ou ativos, de resistência progressiva, de solo de equilíbrio e postural. Como o exercício físico tem ação sistêmica, pode influenciar na expressão de biomarcadores, como exemplo, os microRNAs, que são pequenas moléculas de RNA não codificantes que atuam na transcrição e pós-transcrição para regulação da expressão gênica. Objetivo: avaliar por PCR em tempo real o perfil de expressão do microRNA-34c e do gene BCL-2 relacionados à apoptose no tecido cerebelar, após indução experimental de isquemia cerebral focal temporária, associado ou não a um modelo de realização de exercício físico pré-isquêmico. Material e Métodos: Foram utilizados 22 animais, subdivididos em 4 grupos experimentais: grupo controle, grupo exercício físico, grupo isquêmico, grupo isquêmico + exercício físico. As amostras do tecido cerebelar foram coletadas para a análise da apoptose a partir da expressão do microRNA-34c e do gene BCL-2, pela metodologia de PCR em tempo real. Resultado e conclusão: observamos diferença significativa na expressão do gene BCL-2 no grupo controle em relação aos grupos: exercício físico, isquêmico e exercício físico+ isquêmico. Também foi observado diferença significativa quando comparado a expressão entre MicroRNA-34c e BCL-2, no grupo exercício físico e no grupo exercício físico + isquêmico. Não observamos diferença significativa na expressão do microRNA-34c.Introduction: Cerebrovascular accident (CVA) is a major public health problem and is considered one of the leading causes of death and disability worldwide, which, if left untreated, can result in neuronal damage. In addition, apoptotic processes occur far from the ischemic focus, such as in the cerebellum. Due to the disability caused by the stroke in the individual, rehabilitation is necessary to avoid further damage to the patient\'s health. Therefore, the use of physical exercise can be an alternative to this problem, involving passive or active exercises, progressive resistance, balance and postural exercises. As physical exercise has a systemic action, it can influence the expression of biomarkers, such as microRNAs, which are small non-coding RNA molecules that act in transcription and post-transcription to regulate gene expression. Objective: To evaluate the expression profile of microRNA-34c and BCL-2 gene related to apoptosis in cerebellar tissue after experimental induction of temporary focal cerebral ischemia, associated or not with a model of pre-ischemic physical exercise. Material and Methods: A total of 22 animals were used, subdivided into 4 experimental groups: control group, physical exercise group, ischemic group, ischemic group + physical exercise. Cerebellar tissue samples were collected for the analysis of apoptosis from the expression of microRNA-34c and the BCL-2 gene, using the real-time PCR methodology. Result and conclusion: we observed a significant difference in the expression of the BCL-2 gene in the control group in relation to the groups: physical exercise, ischemic and physical exercise+ ischemic. A significant difference was also observed when comparing the expression between MicroRNA-34c and BCL-2 in the physical exercise group and in the physical exercise + ischemic group. We did not observe a significant difference in the expression of microRNA-34c
70a7a4c11f729b8ced811befa82aa2b7;297950374;Effects of a physical exercise program on physical fitness, stress, anxiety, and quality of life on adolescents with Cerebral Palsy;"Tese de Doutoramento em Ciências do Desporto apresentada à Faculdade de Ciências do Desporto e Educação FísicaThis doctoral thesis aimed to contribute to the development of knowledge associated with an intervention program with physical exercise aimed at adolescents with cerebral palsy, as well as to the production of evidence regarding its effects on physical fitness, depression, stress, anxiety, and quality of life. An extensive literature review was initially carried out with two objectives: first, to identify existing studies on the subject and evaluate their methodological quality; second, to determine the barriers to the practice of physical activity in adolescents with cerebral palsy. After the literature review, an intervention with physical exercises was proposed for the target population. The proposed program was a series of cases, with 15 adolescents with cerebral palsy, classified by the Gross Motor Function Classification System (GMFCS), as I to III, submitted to a physical exercise program in person and online - live, twice a week, for three months, with physical fitness, depression, stress, anxiety and quality of life as outcome measures. The integrative synthesis of the results and discussions of the literature review allowed us to: i) characterize the methodological quality of systematic reviews and meta-analyses on the subject as highly diversified; ii) summarize, based on the International Classification of Functioning, Disability and Health (ICF), the barriers to the practice of physical activity, in the opinion of adolescents with cerebral palsy themselves, and evaluate the methodological quality of qualitative studies on the subject; iii) develop an intervention project with mixed physical exercise, alternating face-to-face and online activities, live, based on aerobic, strength and flexibility exercises, with a frequency of two weekly sessions of 45 minutes each, lasting 12 weeks and moderate to vigorous intensity and immediately after implementing it. The results of the program demonstrated that adolescents exposed to the program show gains in physical fitness and changes in the negative emotional state of depression, stress, and anxiety. Given the positive effects produced by the program, we hypothesize that its design seems to meet the demands of adolescents with cerebral palsy. KEYWORDS: Cerebral palsy, rehabilitation, exercise, physical activity, well-beingA presente tese de doutoramento pretendeu contribuir para o desenvolvimento do conhecimento associado a um programa de intervenção com exercício físico dirigido a adolescentes com paralisia cerebral, bem como para a produção de evidências quanto aos seus efeitos no nível da aptidão física, depressão, estresse, ansiedade e qualidade de vida. Foi realizada inicialmente uma ampla revisão da literatura, com dois objetivos: primeiro identificar os estudos existentes sobre o tema e avaliar a qualidade metodológica desses; segundo identificar as barreiras para a prática de atividade física em adolescentes com paralisia cerebral. Após a revisão da literatura, foi proposta uma intervenção com exercícios físicos na população alvo. O programa proposto foi uma série de casos, com 15 adolescentes com paralisia cerebral, classificados pelo Sistema de Classificação de Função Motora Grossa (GMFCS), como I a III, submetidos a um programa de exercício físico presencial e online - ao vivo, duas vezes na semana, por 3 meses, tendo como medidas de desfecho a aptidão física, depressão, estresse, ansiedade e qualidade de vida. A síntese integrativa dos resultados e discussões da revisão da literatura nos permitiu: i) caracterizar a qualidade metodológica das revisões sistemáticas e meta-análises sobre o tema como altamente diversificadas; ii) sintetizar, baseados na Classificação Internacional de Funcionalidade, Incapacidade e Saúde (CIF), as barreiras para a prática de atividade física, na opinião dos próprios adolescentes com paralisia cerebral e avaliar a qualidade metodológica dos estudos qualitativos sobre o assunto;  iii) elaborar um projeto de intervenção com exercício físico misto, alternando atividade presencial e online, ao vivo, a partir de exercícios de trabalho aeróbio, força e flexibilidade, com frequência de duas sessões semanais de 45 minutos cada, duração de 12 semanas e intensidade moderada a vigorosa e logo após implementá-lo. Os resultados do programa demonstraram que adolescentes expostos ao programa apresentam ganhos na aptidão física e mudança no estado emocional negativo de depressão, estresse e ansiedade. Diante dos efeitos positivos produzidos pelo programa, hipotetizamos que o seu desenho parece atender as demandas de adolescentes com paralisia cerebral.PALAVRAS-CHAVES: Paralisia cerebral, reabilitação, exercício, atividade física, bem estar"
